;Guéguen Nicolas;100 petites expéreinces en psychologie du consommateur:pour mieux comprendre comment on vous influence;100个心理小实验——帮你更聪明地消费;Chinois;Wen yan Ding;上海社会科学院出版社有限公司
;MOLIÈRE;;莫里哀喜剧（1~4）;Chinois;Jianwu LI;
2000;Dan FRANCK;Nu couché;裸体卧像;Chinois;Yiguang ZHOU;华夏出版社
2007;Domitille HERON;Le livre qui avait deux trous;洞里洞外的小老鼠续集;Chinois;Heng Du;接力出版社
2010;Nothomb Amélie;Le Voyage d'hiver;겨울 여행;Coréen;HEO Ji-Eun 허지은;Munhaksegyesa 문학세계사
1996;Jean-Marie COTTERET;Les systèmes électoraux;选举制度;Chinois;Xinmu ZHANG;商务印书馆
2007;Henri BEHAR;André Breton: le grand indésirable;布勒东传;Chinois;Junsheng YUAN;VRIN
1981;Anne NOURRY;Le Combat singulier;搏斗;Chinois;Bangzao ZHU;
2009;;Qu'est-ce que l'Occident ?;什么是西方？;Chinois;Xuemei YAN;广西师范大学出版社
2001;Jean RIVOIRE;L'économie mondiale depuis 1945;1945年以来的世界经济;Chinois;Lichun CHEN;商务印书馆
2008;;Les Images de synthèse;合成的影像;Chinois;Changjing GUO;中国电影出版社
1989;A.M. ANOUAR;;文明与社会理论;Chinois;Ning ZHANG;
1984;Hector Malot;En famille;孤女寻亲记;Chinois;Zeqian ZHANG;
1993;Emile Zola;Paris;巴黎;Chinois;Xiushao BI;
1999;Françoise Sagan;Bonjour, tristesse (suivi de Dans un mois, dans un an);你好，忧愁 ( 含:一个月后，一年之后);Chinois;Xiaoming GUAN;深圳海天出版社
2006;Georges DUMEZIL;Discours de réception de Georges Dumézil à l'Académie française et réponse de Lévi-Strauss;乔治·杜梅泽尔在法兰西科学院就职仪式上的致辞和克劳德·列维—施特劳斯的答辞;Chinois;Hui HE;上海社会科学院出版社有限公司
2001;Paul RICOEUR;Du texte à l'action;من النص إلى الفعل;Arabe;Mohamed Berrada;
1991;Jean KER;Le Carnet noir du bourreau;一个死刑执行人的自述;Chinois;Xiaofeng WANG;
1992;Roger GRENIER;La Fiancée de Fragonard;未婚妻;Chinois;Yumin LI;漓江出版社
1998;René GIRARD;Mensonge romantique et vérité romanesque;浪漫的谎言与小说的真实;Chinois;Peng LUO;生活·读书·新知三联书店
2000;Henri Troyat;La femme de David;大卫夫人;Chinois;Changjing GUO;
2006;Maurice Druon;Les Rois maudits;Az elátkozott királyok;Hongrois;Erzsébet GYÁROS;Európa
1990;Maurice Druon;Les Rois maudits;宫廷恩仇记;Chinois;Xiaofeng WANG;
1996;Jean SERVIER;L'éthnologie;民族学;Chinois;Guang WANG;商务印书馆
1996;;Code du travail et code de la securite sociale;法国劳动法典;Chinois;Jiezhen LUO;国际文化出版公司
1995;Georges VERSINI;Le Bridge;桥牌入门;Chinois;Min XIAO;商务印书馆
1980;Patrick WAJSMAN;L'Illusion de la détente;缓和的幻想;Chinois;Shizhong DING;商务印书馆
1988;Claude MANCERON;Le Tambour de Borodine;拿破仑远征莫斯科：法国历史长河小说;Chinois;Hanquan LIU;
1993;Emile Zola;Une page d'amour;爱情的一页;Chinois;Xiushao BI;
2006;François Truffaut;Hitchcock;希区柯克与特吕弗对话录;Chinois;Kelu ZHENG;VRIN
;Vandewiele Agnes;Mes petites encyclopédies (32 tiltes);幼儿园小百科;Chinois;ZHANG Ruoshi;北京科学技术出版社有限公司
2006;Paul OBADIA;Pedro Almodovar, l'iconoclaste;阿尔莫多瓦：颠覆传统的人;Chinois;Weibo YANG;江苏教育出版社
2011;Georges DIDI HUBERMAN;Ce que nous voyons, ce qui nous regarde;O que nós vemos, O que nos olha ;Portugais;Golgona Anghel,João Pedro Cachopo;Dafne Editora
1998;Georges DIDI HUBERMAN;Ce que nous voyons, ce qui nous regarde;O que vemos, o que nos olha;Portugais;Paulo Neves;Editora 34
1997;Henry-Skoff TORGUE;La pop-music et les musiques rock;流行音乐;Chinois;Zhenhu GUAN;商务印书馆
1932;;Vanina Vanini;青年烧炭党;Chinois;Mutian MU;
;;La Petite Danseuse de Degas;小舞女;Chinois;Hulin HAN;猎文文化发展有限公司
1940;Emile Zola;Contes;水灾集;Chinois;Zhizhou FANG;商务印书馆
1948;Emile Zola;Contes;蒲尔上尉;Chinois;Xiushao BI;
1978;Marius-François GUYARD;La Littérature comparée;الأدب المقارن;Arabe;Henri Zgheib;
1983;Marius-François GUYARD;La Littérature comparée;比较文学;Chinois;Bao YAN;北京大学出版社
1999;Bruno MOSCHETTO;Les activités bancaires internationales;国际银行业务;Chinois;Shuren CHEN;商务印书馆
2007;René GOSCINNY;Histoires inedites du Petit Nicolas(1.On va rentrer 2.M. Mouchabière nous surveille 3.Les nouveaux voisins 4.Le bureau de papa 5.Au chocolat et à la fraise);1.要开学喽！2.木皮先生3.新邻居4.爸爸的办公室5.巧克力草莓冰激凌;Chinois;Jie DAI;PLON PERRIN
1964;Prosper MÉRIMÉE;;梅里美短篇小说选;Chinois;Yonghui ZHENG;商务印书馆
1982;Henri COULONGES;L'Adieu à la femme sauvage;永别了， 疯妈妈;Chinois;Jun XU;
;;Que fait la lune la nuit ?;月亮晚上做什么？;Chinois;Fengbei Xie;接力出版社
1981;Honoré de Balzac;La Vendetta (Contes et nouvelles);家族复仇;Chinois;Kelu ZHENG;漓江出版社
2002;Marie REDONNET;Splendid Hotel;沼澤邊的旅店;Chinois;嚴慧瑩 YEN Hui Ying;大塊文化
1986;Marcel AYMÉ;Contes du chat perché;小姑娘的动物伙伴;Chinois;Yumin LI;
1990;Marcel AYMÉ;Contes du chat perché;捉猫故事集;Chinois;Yumin LI;
1989;Marcel AYMÉ;Contes du chat perché;貓咪躲高高;Chinois;邱瑞鑾 CHIU Jui Luan;聯經出版公司
;Bizien Jean-Luc;Vivez L'aventure (10 Titles);巨龙最后的魔法，石中剑，兰斯洛特的决战，亚瑟王和圆桌骑士，寻找爱尔菲巫师，云中城堡的阴谋，法老的陷阱，仙女山的诅咒,塞塔城的神秘配方,魔法森林的诱惑;Chinois;LI Wenrui;北京科学技术出版社有限公司
1949;MOLIÈRE;Le Bourgeois gentilhomme;向贵人看齐;Chinois;Jianwu LI;
;Pierre LAMAISON;Histoire de la civilisation occidentale: généalogie de l'Europe;西方文明史:欧洲谱系;Chinois;Weixing CHEN;中国人民大学出版社
2009;;Le Futur de la Mode;时尚不死？关于时尚的终极诘问;Chinois;yu wang;中国纺织出版社
1990;Alexandre Dumas;La Dame de Monsoreau;蒙梭罗夫人;Chinois;Yonghui ZHENG;上海译文出版社
2008;Samir AMIN;L'accumulation à l'échelle mondiale, Critique de la théorie du sous-développement;世界规模的积累;Chinois;Mingzhu YANG;社会科学文献出版社
1987;Henri Troyat;Le Moscovite;莫斯科人;Chinois;Linsen QIAN;春风文艺出版社
1951;Honoré de Balzac;Un ménage de garçon;单身汉的家事;Chinois;Mingkai GAO;
1979;Honoré de Balzac;Un ménage de garçon;搅水女人;Chinois;Lei FU;人民文学出版社
;;test;test;Chinois;Hong anqi;易倍出版社
1987;Charles Baudelaire;Essais esthétiques;波德莱尔美学论文选;Chinois;Hongan GUO;人民文学出版社
1997;Jules Verne;Les Enfants du capitaine Grant;Grant kapitány gyermekei;Hongrois;Zoltán MAJTÉNYI;Unikornis
1999;Michel GIRARD;Les individus dans la politique internationale;幻想与发明 : 个人回归国际政治;Chinois;Runchang XI;社会科学文献出版社
1987;François Perroux;Pour une philosophie du nouveau développement;新发展观;Chinois;Ning ZHANG;华夏出版社
1985;Georges LENÔTRE;Trois siècles d'histoire de France;法国历史轶闻;Chinois;Dianzhong WANG;
1995;;Code des Sociétés;法国公司法典;Chinois;Jiezhen LUO;国际文化出版公司
1992;Madame de STAËL;Delphine;台尔芬;Chinois;Ziqiang LIU;
1986;Jean-Paul Sartre;L'Age de raison;理智之年;Chinois;Ding YA;
2008;Clochard Sévrine;Vive Les Filles! - Le Guide De Celles Qui Seront Bientôt Ados!;¡Vivan las chicas! : ¡la guía de las que pronto serán adolescentes!;Espagnol;Mercedes López-Ballesteros;Mare Nostrum
1992;S.J. JOSEPH DEHERGNE;Juifs de Chine à travers la correspondance inédite des jésuites du dix-huitième siècle;中国的犹太人;Chinois;Sheng GENG;
2007;Guy Petitdemange;Philosophes & philosophies du XXe siècle;20世纪的哲学与哲学家;Chinois;Chengfu LIU;江苏教育出版社
1987;Claude ANET;Mayerling;梅亚林离恨;Chinois;Lide TAN;北岳文艺出版社
;Pierre ASSOULINE;Gaston Gallimard : Un demi-siècle d'édition française;伽利玛：半个世纪的法国出版史;Chinois;Xiaoyue HU;上海九久读书人文化实业有限公司
1997;Fernand BOUQUEREL;Les études de marché;市场研究;Chinois;Jian SHEN;商务印书馆
1993;Aly MAZAHERI;La Route de la soie;丝绸之路——中国波斯文化交流史;Chinois;Sheng GENG;中华书局
2008;Romain Gary;Les Racines du ciel;Las raíces del cielo;Espagnol;Mercedes Corral;Debolsillo
1996;Jean CHALINE;L'évolution biologique humaine;从猿到人: 人的进化史;Chinois;Zhenhu GUAN;商务印书馆
1989;Colette DAVENAT;L'Amour aux cent facettes;千娇百媚;Chinois;Xiaoqing CHEN;
1997;André LABOURDETTE;Les régimes de retraite;退休制度;Chinois;Xiaolei FAN;商务印书馆
1947;Georges Duhamel;Civilisation (Contes);文明;Chinois;Lei FU;
1956;Georges Duhamel;Civilisation (Contes);文明;Chinois;Lei FU;
1989;Michel CROZIER;La Société bloquée;被封锁的社会;Chinois;Yuming DI;商务印书馆
1985;Simone de Beauvoir;Tous les hommes sont mortels;人都是要死的;Chinois;Zhencheng MA;
1935;Romain Rolland;Vie de Tolstoï;托尔斯泰传;Chinois;Lei FU;商务印书馆
2007;Jules VALLÈS;L'Insurgé;El insurrecto;Espagnol;Manuel Serrat Crespo;ACVF
2004;Pierre ROSANVALLON;Le capitalisme utopique —Histoire de l'idée de marché(première édition, 1989, 256 p. et deuxième édition, 1999, p. 251);乌托邦资本主义 —市场观念史;Chinois;Bin Xiao;社会科学文献出版社
1997;Robert LANQUAR;Sociologie du tourisme et des voyages;旅游和旅行社会学;Chinois;Lichun CHEN;商务印书馆
1998;Genevieve D'HAUCOUR;La vie au moyen âge;中世纪的生活;Chinois;Tang FENG;商务印书馆
1999;Jean PIAGET;Epistémologie des sciences de l'homme;人文科学认识论;Chinois;Wenbin ZHENG;中央编译出版社
1993;Emile Zola;Rome;罗马;Chinois;Xiushao BI;
1987;STENDHAL;Récits et nouvelles;司汤达中短篇小说选;Chinois;Weizhong NI;
1985;Roger Vailland;325 000 francs;325,000法郎;Chinois;Qing'an LI;
1986;Roger Vailland;325 000 francs;三十二万五千法郎;Chinois;Fang ZHANG;
2007;Jules Verne;Un Capitaine de quinze ans;A tizenötéves kapitány : regény;Hongrois;László PASSUTH;Regun
1996;Jules Verne;Un Capitaine de quinze ans;A tizenötéves kapitány;Hongrois;Károly SZÁSZ;Alexandra
2008;Jules Verne;Un Capitaine de quinze ans;A tizenöt éves kapitány;Hongrois;Károly SZÁSZ;Kv. Népszabadság
1995;Guy THUILLIER;La politique du travail;劳动政策;Chinois;Quan YU;商务印书馆
1998;Robert Merle;La Violente amour;Szenvedélyes szeretet;Hongrois;Lívia GÖRÖG;Európa
2008;Henri GOUHIER;Rousseau et Voltaire: Portraits dans deux miroirs;卢梭与伏尔泰：两面镜子、两个形象;Chinois;Cheng Pei;华东师范大学出版社
1953;Ernest PÉROCHON;Contes des cent et un matins;两只小山羊;Chinois;Dachun YANG;
2004;Philippe Delerm;Le Bonheur;瞥见幸福颜色;Chinois;Lin CHE;MINUIT
1988;Marcel Martin;La Langage cinématographique;电影作为语言;Chinois;Jiahe ZHAO;中国社会科学出版社
;Mangot Mickael;50 Petites experiences en psychologie de l'epargnant et de l'investisseur:pour mieux reussir tous ros placements;50个心理小实验：帮你更好地投资理财;Chinois;yuan xu;上海社会科学院出版社有限公司
2007;Jules Verne;Le Château des Carpathes;Várkastély a Kárpátokban : regény;Hongrois;György GELLÉRT;Regun
1981;Jules Verne;Le Château des Carpathes;喀尔巴阡古堡;Chinois;Baoyuan LI;
2009;AUMONT,MARIE Jacques ,Michel;Dictionnaire théorique et critique du cinéma;Dicionário Teórico e Crítico do Cinema;Portugais;Carla Bogalheiro Gamboa,Pedro Elói Duarte;Texto & Grafia
1942;Honoré de Balzac;Contes;巴尔扎克短篇集;Chinois;Mutian MU;
1945;Honoré de Balzac;Contes;戴依夫人;Chinois;Sai LUO;
1946;Honoré de Balzac;Contes;戴依夫人;Chinois;Sai LUO;
1995;Pierre BRIANT;Alexandre Le Grand;亚历山大大帝;Chinois;Yadong LU;商务印书馆
1998;Patrice FONTAINE;Les marchés financiers internationaux;国际金融市场;Chinois;Junrui XIE;商务印书馆
1927;Emile Zola;Le Paradis des chats(morceaux choisis);猫的天堂;Chinois;Fu LIU;
1982;René GAGNAT;Euroshima: Construire l'Europe de la défense;欧洲广岛：建设有防务的欧洲;Chinois;Weimin MA;
2008;;L'Economie du cinéma;电影经济学;Chinois;Yunzhou LIU;中国电影出版社
2001;Guilheme FABRE;Les Prospérités du crime. Trafic de stupéfiants, blanchiment et crises financières dans l'après-guerre froide;犯罪致富——毒品走私、洗钱与冷战后的金融危机;Chinois;Qiyun SU;社会科学文献出版社
1938;Henri Barbusse;Staline;史太林传;Chinois;Maoyong XU;
;;Les exilés de Montparnasse / 1920-1940;蒙帕纳斯的流亡者;Chinois;Xiaoming GUAN;猎文文化发展有限公司
1949;MOLIÈRE;George Dandin;乔治•党丹;Chinois;Jianwu LI;
2001;Nathalie Sarraute;Portrait d'un inconnu;Retrato de un desconocido. Prólogo de Jean-Paul Sartre;Espagnol;Roberto Bixio;
2000;Nathalie Sarraute;Portrait d'un inconnu;一个陌生人的画像;Chinois;Qin BIAN;译林出版社
2007;Léon Duguit;Les Transformations du droit public;Las transformaciones del derecho público y privado;Espagnol;Adolfo Posada;Comares
1983;Henri Troyat;La Neige en deuil (Romans);被玷污的雪;Chinois;Qing'an LI;
;Dominique de VILLEPIN;Un autre monde;另一个世界;Chinois;Weixing CHEN;中国人民大学出版社
1989;Albert SOBOUL;La Révolution française;法国大革命史;Chinois;Shengli MA;社会科学文献出版社
2000;Didier Decoin;Louise;路易丝;Chinois;Kefei ZHAO;华夏出版社
1985;Claude MICHELET;Les Gens de Saint-Libéral;圣利贝拉尔的人们;Chinois;Faming GAO;上海译文出版社
2008;Jules Renard;Histoires naturelles;Historias naturales;Espagnol;Joan Riambau Möller;Debolsillo
1997;Michel VEUILLE;La sociobiologie;社会生物学;Chinois;Zhaotong SUN;商务印书馆
1988;Michel VEUILLE;La sociobiologie;社会生物学;Chinois;Shicai YIN;社会科学文献出版社
1949;Honoré de Balzac;Illusions perdues (deuxième partie: Un grand homme de province à Paris);外省伟人在巴黎;Chinois;Mingkai GAO;
1951;Honoré de Balzac;Illusions perdues (deuxième partie: Un grand homme de province à Paris);外省伟人在巴黎;Chinois;Mingkai GAO;
1944;Honoré de Balzac;Illusions perdues (deuxième partie: Un grand homme de province à Paris);巴黎烟云;Chinois;Mutian MU;
;Alexandre LAIGNEL-LAVASTINE;Esprits D'Europe: Autour De Czesaw Miosz, Jan Potofcka,Istvan Bibo;欧洲精神：围绕切斯拉夫·米沃什，雅恩·帕托什卡和伊斯特万·毕波展开;Chinois;Dai Qiao;上海三辉咨询有限公司
1983;Honoré de Balzac;Une ténébreuse affaire;一桩神秘的案件;Chinois;Yonghui ZHENG;人民文学出版社
2005;Résie POUYANNE;Le libre galop des Pottoks;自由奔跑的小野马;Chinois;Chengfu LIU;接力出版社
1986;Jacques LECAILLON;Analyse micro-économique;微观经济分析;Chinois;Chuanming CHEN;
1980;Honoré de Balzac;Eugénie Grandet. Le Père Goriot;欧也妮.葛朗台 高老头;Chinois;Lei FU;人民文学出版社
1930;Anatole France;Abeille;蜜蜂;Chinois;Mutian MU;
1990;Gérard GENETTE;Figures III (Discours du récit): Nouveau discours du récit;叙事话语： 新叙事话语;Chinois;Wenrong WANG;中国社会科学出版社
2000;Françoise LEFEVRE;Consigne des minutes heureuses;幸福存摺;Chinois;Ping WANG;
1991;Pierre BRUNEL;Histoire de la littérature française (T.2, 2ème partie: Le vingtième siècle);20世纪法国文学史;Chinois;Kelu ZHENG;
1993;Henri R.P. BERNARD;Le père Mathieu Ricci et la société chinoise;利玛窦评传;Chinois;Zhenhu GUAN;商务印书馆
1990;Marcel Proust;A la recherche du temps perdu(T.2);追忆似水年华(2):在少女们身旁;Chinois;Yufang GUI;译林出版社
2011;Jean-Luc MARION;Réduction et donation : Recherches sur Husserl, Heidegger et la phénoménologie;Reducción y donación. Investigaciones acerca de Husserl, Heidegger y la fenomenología;Espagnol;Pablo Corona;Prometeo
;Jean-Luc MARION;Réduction et donation : Recherches sur Husserl, Heidegger et la phénoménologie;还原与给予;Chinois;xiang hong fang;上海译文出版社
1995;François FENELON;Les aventures de Télémaque;太雷马克历险记;Chinois;Weizhong NI;
1993;Alain PEYREFITTE;L'Empire immobile ou le Choc des mondes;停滞的帝国——两个世界的撞击;Chinois;Guoqing WANG;生活·读书·新知三联书店
1985;Blaise Pascal;Pensée sur la religion et sur quelques autres sujets;思想录：论宗教和其他主题的思想;Chinois;Zhaowu HE;商务印书馆
1992;Charles Baudelaire;Oeuvres choisies;波德莱尔散文选;Chinois;Zhiting (Nom de plume: Huai Yu) ZHANG;百花文艺出版社
2007;Jules Verne;L'Archipel en feu;A lángban álló szigettenger;Hongrois;László VAJTHÓ;Regun
;;test;test;Chinois;Hong anqi;易倍出版社
1991;Léo MALET;Fièvre au Marais;巴黎老区的狂乱;Chinois;Jiachen GU;中国戏剧出版社
2001;Yann Andréa STEINER;Cet amour-là;我，奴隶与情人: 杜拉斯最后一个情人的自述;Chinois;Weichuan PENG;深圳海天出版社
1997;Gustave LE BON;Psychologie des foules (Crowd: The study of popular mind);乌合之众 : 大众心理研究;Chinois;Keli FENG;中央编译出版社
1982;Luce BOULNOIS;La Route de la Soie;丝绸之路;Chinois;Sheng GENG;
1990;Albert Camus;L'Etranger. La Peste (suivis d'autres oeuvres de l'auteur);局外人 鼠疫;Chinois;Hongan GUO;漓江出版社
1991;Jacques GERNET;Chine et Christianisme: Action et réaction;中国和基督教教;Chinois;Sheng GENG;
1957;;Le mégot (Nouvelles);烟斗：短篇小说集;Chinois;Daoqian(1921— 1993) WANG;
2002;Charles de MONTESQUIEU;Lettres persanes;페르시아인의 편지;Coréen;LEE Suji 이수지;DD World 다른세상
2006;Francoise Sagan;Derrière l'épaule;肩后;Chinois;Kangru Wu;广西师范大学出版社
2007;Daniel Pennac;Le dictateur et le hamac;독재자와 해먹;Coréen;LIM Hee-Kun 임희근;Munhak dongne 문학동네
2007;Charles Perrault;;Perrault meséi;Hongrois;Eduardo TRUJILLO;Napraforgó
1949;MOLIÈRE;Le Médecin malgré lui;屈打成医;Chinois;Jianwu LI;
1993;Rolf Alfred STEIN;Recherches sur l'épopée et le barde au Tibet;西藏史诗和说唱艺人的研究;Chinois;Sheng GENG;
1981;VOLTAIRE;Zadig et autres contes;查第格;Chinois;Lei FU;人民文学出版社
1991;Jean-Paul Sartre;Essais critiques;萨特文论选;Chinois;Kangqiang SHI;人民文学出版社
1992;Claude VILLARD;;法国社会主义简史;Chinois;Songhao CAO;
1993;Emile Zola;La joie de vivre;生的快乐;Chinois;Xiushao BI;
1957;Jules Verne;Le Phare du bout du monde;天边灯塔;Chinois;Xuliang ZHOU;
2007;Anatole France;La révolte des anges;La rebelión de los ángeles;Espagnol;Agustín Izquierdo Sánchez;Valdemar
1987;Jacques GERNET;Les Aspects économique du bouddhisme dans la société chinoise du 5e au 10e siècle;中国五-十世纪的寺院经济;Chinois;Sheng GENG;
1978;MOLIÈRE;;莫里哀喜剧六种;Chinois;Jianwu LI;上海译文出版社
1995;Alain BAVELIER;Le commerce extérieur;对外贸易;Chinois;Ming YUAN;商务印书馆
;;Le siecle de Dali;达利的世纪;Chinois;fangmin Ding;猎文文化发展有限公司
1984;André Malraux;;马尔罗研究;Chinois;Mingjiu LIU;漓江出版社
2007;Nathalie KAUFMANN;Mère, mon beau souci;母亲，我的千思百虑;Chinois;Kelu ZHENG;VRIN
2007;asd asd;Histoires inédites du Petit Nicolas, Tome 2;Més històries inèdites del petit Nicolas;Catalan;Jaume Ribera;La Galera
2007;asd asd;Histoires inédites du Petit Nicolas, Tome 2;Novas Aventuras do Menino Nicolau (O Regresso do Menino Nicolau - Vol. 3);Portugais;Miguel Rodrigues;Teorema
1988;;;莫与女人作戏;Chinois;Min XIAO;
2007;Roland Barthes;Eléments de Sémiologie;Elementos de Semiologia ;Portugais;Maria Margarida Barahona;Edições 70
1999;Roland Barthes;Eléments de Sémiologie;符号学原理;Chinois;Dongliang WANG;生活·读书·新知三联书店
1992;Roland Barthes;Eléments de Sémiologie;符号学原理;Chinois;Tianyuan HUANG;
1999;Alain ROBBLE-GRILLET;Les gommes;橡皮;Chinois;Xiuqing LIN;译林出版社
1995;Jacques,d' Hondt;Hegel et Hegelianisme;黑格尔和黑格尔主义;Chinois;Dong LUAN;商务印书馆
1958;Honoré de Balzac;Essais critiques;巴尔扎克论文选;Chinois;Jianwu LI;
;Roland Barthes;Comment vivre ensemble : Cours et séminaires au Collège de France (1976-1977);如何共同生活;Chinois;Weixing CHEN;中国人民大学出版社
1986;James Russell HAMILTON;Les Ouighours à l'époque des Cinq Dynasties;五代回鹘史料;Chinois;Sheng GENG;
2007;Patrick LEMOINE;Séduire: comment l'amour vient aux humains;诱惑：爱如何降临人类;Chinois;Hong HUANG;华东师范大学出版社
1985;Roger Martin du Gard;Les Thibault (T.3);蒂博一家(下);Chinois;Xiaofeng WANG;上海译文出版社
1985;Roger Martin du Gard;Les Thibault (T.3);蒂博一家(第3册);Chinois;Kelu ZHENG;漓江出版社
1989;Romain Rolland;La vie de Beethoven;巨人三传;Chinois;Lei FU;
1987;Emmanuel ROBLÈS;Venise en hiver;威尼斯的冬天;Chinois;Anding GUO;
1936;André Maurois;Sentiments et coutumes;人生五大问题;Chinois;Lei FU;商务印书馆
1986;André Maurois;Sentiments et coutumes;人生五大问题;Chinois;Lei FU;生活·读书·新知三联书店
1992;Claude THELOT;Tel père tel fils?;父贵子荣：社会地位和家庭出身;Chinois;Shicai YIN;社会科学文献出版社
2006;Roland Barthes;Le degré zéro de l'écriture;O grau zero da escrita ;Portugais;Maria Margarida Barahona;Edições 70
;Antoine Bioy;L’hypnose;催眠;Chinois;Caiwei YUAN;化学工业出版社
1987;Georges COEDÈS;Textes d'auteurs grecs et latins relatifs à l'Extrême-Orient depuis le IVe siècle avant J-C. jusqu'au XIVe siècle;希腊拉丁作家远东古文献辑录;Chinois;Sheng GENG;中华书局
1989;Michel HOST;Valet de nuit;黑夜的奴仆;Chinois;Mingpei DAI;
1997;André BOSSAR;La criminalité internationale;国际犯罪;Chinois;Xiaoling HUANG;商务印书馆
2007;Paul RICOEUR;Le juste(tome 1 en 1995, tome 2 en 2001);论公正;Chinois;Chunming CHENG;法律出版社
1986;Francois CHABREY;Matt trappe au `Golden Gate`;潜影;Chinois;Ming YUAN;
2008;;Nouveau Code de Procedure Cilvile (edition 2007, 98e);法国新民事诉讼法典（上、下）;Chinois;Jiezhen LUO;法律出版社
1992;Jean-Marie LE CLÉZIO;Mondo et autres histoires;少年心事;Chinois;Longge JIN;漓江出版社
1999;Edgar MORIN;Le Paradigme perdu: la nature humaine;迷失的范式：人性研究;Chinois;Yizhuang CHEN;北京大学出版社
1989;Gabriel FERRAND;Relations de voyages et textes géographiques arabes, persans et turcs relatifs à l'Extrême-Orient du VIIIe siècle;阿拉伯波斯突厥人东方文献辑注;Chinois;Sheng GENG;中华书局
1997;Roger GRENIER;Albert Camus: soleil et ombre;阳光与阴影 : 阿贝尔·加缪传;Chinois;Jiachen GU;北京大学出版社
1997;Jules CARLES;L'origine des espèces;物种起源;Chinois;Xiaoping BIAN;商务印书馆
2000;Jean-Denis BREDIN;Convaincre;说服：关于雄辩的对话;Chinois;Lin CHE;百花文艺出版社
1948;Emile Zola;Naïs Micoulin;娜薏.米枯伦;Chinois;Xiushao BI;
1989;Jean-Paul Sartre;Autoportrait à soixante-dix ans;七十述怀;Chinois;Kangqiang SHI;
2005;Paul RICOEUR;Soi-même comme un autre;الذات عينها كآخر;Arabe;Georges Zitani;
2012;Irene Nemirovsky;Les chiens et les loups;Os cães e os lobos;Portugais;Júlia Ferreira,José Cláudio;Relógio d'Água
2007;Irene Nemirovsky;Les chiens et les loups;狗与狼;Chinois;Xiaoming GUAN;猎文文化发展有限公司
1980;VOLTAIRE;Contes choisis;伏尔泰小说选;Chinois;Lei FU;人民文学出版社
2008;André BAZIN;Orson Welles;Orson Welles : Ciudadano Kane;Espagnol;Antonio Rodríguez Esteban;Diario El País
2005;André BAZIN;Orson Welles;Orson Welles;Portugais;André Telles;Zahar
1981;Madame de STAËL;De l'Allemagne;德国的文学与艺术;Chinois;Shizhong DING;人民文学出版社
1992;Pierre CAMARRA;La Fabuleuse aventure de Cristobal Colon;哥伦布传奇的一生;Chinois;Xiaozhen DU;生活·读书·新知三联书店
2008;STENDHAL;Le Rouge et le Noir;El roig i el negre;Catalan;Ferran Toutain;Labutxaca
2008;STENDHAL;Le Rouge et le Noir;Rojo y negro;Espagnol;Juan Díaz de Atauri;Grupo RBA
1998;STENDHAL;Le Rouge et le Noir;الأحمر والأسود;Arabe;Abdel Hamid El-Dawakhly;دار شرقيات
1962;STENDHAL;Le Rouge et le Noir;الأحمر والأسود;Arabe;Ghayath Hajjar;
1993;STENDHAL;Le Rouge et le Noir;红与黑;Chinois;Hongan GUO;译林出版社
1990;Honoré de Balzac;Oeuvres complètes (T.19 : Comédie humaine : Etudes de moeurs. Scènes de la vie de campagne 2);巴尔扎克全集 第十九卷 人间喜剧：风俗研究：乡村生活场景 (2);Chinois;Yumin LI;人民文学出版社
1954;Honoré de Balzac;La messe de l'athée;无神者做弥撒;Chinois;Mingkai GAO;
1987;Alain RODE;Alain Delon;阿兰•德隆;Chinois;Mingpei DAI;
2000;Jacques Laurent;Les bêtises;蠢事;Chinois;Xiaoqing CHEN;华夏出版社
1945;Jean-Jacques Bernard;Trois pièces de théâtre;亚维尔的秘密;Chinois;Liewen LI;
1988;Jean STOELZEL;Les valeurs du temps présent: Une enquête européenne;当代欧洲人的价值观念;Chinois;Xianggan LU;社会科学文献出版社
1992;Rene-Victor Pilhes;L'Imprécateur;神的诅咒;Chinois;Zihua JIANG;
2006;Jean BAUDRILLARD;L'échange symbolique et la mort;象征性交换与死亡;Chinois;Jinshan CHE;译林出版社
2008;Antoine, de SAINT-EXUPERY;Le Petit Prince;El Principito;Espagnol;Bonifacio del Carril;Salamandra
1983;Roger Martin du Gard;Les Thibault (T.1);蒂博一家(第1册);Chinois;Kelu ZHENG;漓江出版社
;;Sur les pas de George Sand;追寻乔治·桑德的足迹;Chinois;Xiaoqiu Wu;PRESSES UNIVERSITAIRES DE FRANCE - PUF
1995;;Code de commerce;法国商法典;Chinois;Banggui JIN;国际文化出版公司
2002;Jean BESSIERE;Histoire des Poétiques;诗学史;Chinois;Zhongyi SHI;百花文艺出版社
