2003;;Il était une fois la Mésopotamie;美索不達米亞：兩河流域的文明曙光;Chinois;馬向陽 MA Hsiang-Yang;時報出版
2008;Philippe Claudel;Le rapport de Brodeck;L'informe de Brodeck;Catalan;Lourdes Bigorra;RBA Libros
2009;Philippe Claudel;Le rapport de Brodeck;波戴克報告;Chinois;賈翊君 CHIA Yi Chun;木馬文化
2005;;La Princetta et le Capitaine;小公主與船長;Chinois;顏湘如 YEN Hsiang Ju;繆思出版
2003;;Le Loup mongol;蒙古蒼狼;Chinois;王柔惠 WANG Jou Hui;麥田出版
2008;;L'eau;El agua;Espagnol;Paz Barroso Fernández-Araoz;Ediciones SM
2008;;L'eau;L'aigua al teu abast;Catalan;Judit Valentines i Vilaplana;Cruïlla
2002;;L'eau;第一次知識大發現(水);Chinois;林永珊 LIN Yung Shan;青林國際出版股份有限公司
2002;Michel Tournier;Vendredi, ou, Les limbes du Pacifique;禮拜五;Chinois;王道乾 WANG Tao Chien;皇冠文化出版有限公司
2008;;Tara Duncan：le sceptre maudit (Tome 3);塔拉的奇想冒險（3） 魔法的王杖;Chinois;張喬玟 CHANG Chiao Wen;英屬維京群島商高寶國際有限公司台灣分公司
1996;Jean Genet;Notre Dame des fleurs;繁花聖母;Chinois;阮慶岳 JUAN Ching Yue;時報出版
2009;Guillaume Musso;Sauve-moi;救救我！;Chinois;張懿德 CHANG Yi Der;皇冠文化出版有限公司
2009;;Mon traître;背叛者之歌;Chinois;武忠森 WU Chung Sen;天培文化有限公司
2006;;Le Parfum de l'invisible, tome 2;激情香水 II;Chinois;于尚白 YU Shang Bo;大辣出版
2008;;La grenouille qui ne savait pas qu'elle était cuite... et autres leçons de vie;La rana que no sabía que estaba hervida-- : y otras lecciones de vida;Espagnol;J. A. Bravo;Maeva
2006;;La grenouille qui ne savait pas qu'elle était cuite... et autres leçons de vie;青蛙不知道自己快被煮熟了;Chinois;葉如惠 YEH Ju Hui;奧林文化&大穎文化
2009;;La femme de papier;分手後的法式幻想;Chinois;繆詠華 MIAO Yung Hua;
2008;;Au nom du père;把米其林名廚帶回家-三星女主廚的法式料理;Chinois;賈翊君 CHIA Yi Chun;台灣商務印書館
2002;;Le théâtre nouveau en France;法國新戲劇;Chinois;阮若缺 JUAN Jo Chueh;麥田出版
2009;;A 10 kilos du bonheur;十公斤的幸福;Chinois;顏湘如 YEN Hsiang Ju;台灣商務印書館
2000;Christian Jacq;Ramsès, tome 2 : Le Temple des millions d'années;百萬年神殿─拉美西斯五部曲之二;Chinois;王玲琇 WANG Ling Hsiu;麥田出版
2007;;Moi, c'est Quoi?;¿Qué soy yo?;Espagnol;Beatriz Bueno Mateos;Edebé
2007;;Moi, c'est Quoi?;我，是什麼呢？;Chinois;謝蕙心 HSIEH Hui Hsin;米奇巴克有限公司
2000;Christian Jacq;Ramsès, tome 4 : La Dame d'Abou Simbel;皇后之愛－拉美西斯五部曲之四;Chinois;王玲琇 WANG Ling Hsiu;麥田出版
2004;Alphonse Boudard;Les trois mamans du petit Jésus;小耶穌的三個媽媽;Chinois;江碧君 CHIANG Pi Chun;皇冠文化出版有限公司
2010;;Le courage et la peur;勇氣與恐懼;Chinois;吳愉萱 WU Yu Hsuan;米奇巴克有限公司
2005;;Le Sel à petits pas;活在鹽的世界裡;Chinois;陳秋玲 CHEN Chiu Ling;鄉宇文化事業股份有限公司
2008;;Le marketing expliqué à ma mère : L'art du positionnement;棉花糖行銷學;Chinois;繆詠華 MIAO Yung Hua;知識流出版社
2007;;L'Année du Coq: Chinois et rebelles;El año del gallo : chinos y rebeldes;Espagnol;Delia Mateovich;Gota a Gota
2012;;L'Année du Coq: Chinois et rebelles;O Ano do Galo - Verdades sobre a China;Portugais;Margarita Maria Garcia Lamelo ;É Realizações
2006;;L'Année du Coq: Chinois et rebelles;謊言帝國—中國雞年紀行;Chinois;許益源 CHU Yi-Yuan;允晨文化
2005;;Le Balayeur du désert;沙漠清掃人;Chinois;李友平 LI Yio Ping;台灣商務印書館
2009;Jean-Louis Fournier;Où on va papa?;爸爸，我們去哪裡？;Chinois;黃琪雯 HUANG Chi Wen;寶瓶文化
2009;;Mais qu'est-ce qui passe par la tête des méchants ?;壞人到底在想什麼？;Chinois;黃馨慧 HUANG Hsin Hui;麥田出版
2008;Philippe Djian;37, 2°C Le matin;巴黎野玫瑰;Chinois;沈台訓 SHEN Tai Hsun;麥田出版
2000;Christian Jacq;Ramsès, tome 3 : La Bataille de Kadesh;卡德墟戰役─拉美西斯五部曲之三;Chinois;王玲琇 WANG Ling Hsiu;麥田出版
1999;;Une nuit sans dormir;離家一夜;Chinois;劉美欽 LIU Mei Chin;玉山社出版事業股份有限公司
2005;;L'Homme et le Lion : Un conte d'Egypte;埃及人與獅子;Chinois;李友平 LI Yio Ping;台灣商務印書館
2008;;Libre et pas libre;自由與不自由;Chinois;劉德馨 LIU De Hsin;米奇巴克有限公司
2002;;Comme un grand;只要我長大;Chinois;殷麗君 YIN Li Chun;格林文化
2007;;Votre chien et vous : Mieux le comprendre pour mieux l'aimer;了解你的狗;Chinois;喬凌梅 CHIAO Ling Mei;世茂出版社
2002;;Le trésor de Clara;克拉拉的寶藏;Chinois;劉美欽 LIU Mei Chin;三之三文化出版社
2007;;Le meilleur et le pire de l'oncle Sam : 100 raisons d'aimer et de détester les Etats-Unis;喜歡與討厭美國的100個理由;Chinois;沈台訓 SHEN Tai Hsun;玉山社出版事業股份有限公司
2008;;Mercredi mensonge;週三的謊言;Chinois;林說俐 LIN Yue Li;天培文化有限公司
2004;;Lettres de l'écureuil à la fourmi;松鼠寫給螞蟻的信;Chinois;尉遲秀 YU Chih Hsiu;大田出版有限公司
2010;;Les triplés et Toto;巴黎三寶貝：多多來了;Chinois;阮若缺 JUAN Jo Chueh;格林文化
2006;;Autour des anges;天使娃娃與裝飾;Chinois;張一喬 CHANG Yi Chio;太雅生活館
2011;;Lettres d'amour à des petites chipies;給臭女生的小情書;Chinois;Jade LEE 李良玉;聯經出版公司
1999;Victor Hugo;Les Misérables. Tome 3;悲慘世界(下);Chinois;李玉民 LI Yu Min;貓頭應出版社
2010;;Pénélope tête en l'air, Tome 3 : Bon appétit, Pénélope !;Penelope貝貝生活繪本：貝貝肚子餓;Chinois;徐硯怡;滿天星文化出版有限公司
2005;;Mes Premières Decouvertes De L'art : Bestiaire;第一次藝術大發現(動物群像);Chinois;林達;青林國際出版股份有限公司
2011;;Le Pain par Poilâne;普瓦蘭麵包之書;Chinois;陳太乙 CHEN Tai Yi;時報出版
2008;Patrick Modiano;Dans le café de la jeunesse perdue;En el cafè de la joventut perduda;Catalan;Joan Casas;Proa
2010;Patrick Modiano;Dans le café de la jeunesse perdue;在青春迷失的咖啡館;Chinois;王東亮 WANG Dong Liang;允晨文化
2008;;Où es-tu parti?;你到哪裡去了？;Chinois;劉清彥 LIU Ching Yen;三之三文化出版社
2011;;Ali Baba;阿里巴巴;Chinois;尉遲秀 YU Chih Hsiu;天下雜誌出版
2006;;Les catastrophes de Gaspard et Lisa, Tome 19 : Un cadeau pour maman;給媽媽的禮物;Chinois;曹慧 TSAO Hui;繆思出版
2007;;Expériences pour construire;建築的遊戲;Chinois;林淑真 LIN Shu Zhen;
2006;;La riviere a l’envers: Tomek;逆流河，托梅克;Chinois;賈翊君 CHIA Yi Chun;繆思出版
2008;;L'histoire du lion qui ne savait pas écrire;不會寫字的獅子;Chinois;吳愉萱 WU Yu Hsuan;米奇巴克有限公司
2010;;Mission bouille de grenouille;任務代號：青蛙臉;Chinois;張雅婷;暢談國際文化事業股份有限公司
2008;Samuel Beckett;En attendant Godot, Fin de partie de Samuel Beckett : Analyse,Reperes,Critiques;等待果陀、終局;Chinois;廖玉如 LIAO YU JU;聯經出版公司
2007;;Cap-Horn;合恩角;Chinois;黃秀錦 HUANG Hsiu Chin;奧林文化&大穎文化
2008;;Sulla letteratura;艾可談文學;Chinois;翁德明 WONG De Ming;皇冠文化出版有限公司
2009;;Mes remèdes de Grand-Mère;阿嬤的療法－－法國醫生也愛用的居家護理小百科;Chinois;沈倖如 SHEN Hsing Ju;方智出版社
2010;;L'envol du hérisson;飛行刺蝟;Chinois;尉遲秀 YU Chih Hsiu;
2005;;Le chat a vomi;貓咪吐了;Chinois;賈翊君 CHIA Yi Chun;美麗殿文化
2007;;L'Encyclo des filles;Manual de las chicas;Espagnol;Ana Tortosa Rey-Stolle;Mare Nostrum
2006;;L'Encyclo des filles;法國女魅力小百科;Chinois;陳太乙 CHEN Tai Yi;方智出版社
2004;;Une Paille pour deux;雙人吸管;Chinois;曹慧 TSAO Hui;遠流出版公司
2010;;Je vous aime tant;我是如此愛慕你;Chinois;李尚遠 LEE Shang Yuan;聯經出版公司
2010;;Pénélope tête en l'air, Tome 5 : Pénélope fait les courses;Penelope貝貝生活繪本：貝貝上街去;Chinois;徐硯怡;滿天星文化出版有限公司
2003;Enki Bilal;Nikopol, tome 1 : La Foire aux Immortels;諸神混亂;Chinois;林說俐 LIN Yue Li;大辣出版
2005;;Mes Premières Decouvertes De L'art : Henri Matisse;第一次藝術大發現(認識馬蒂斯);Chinois;林雅珠 LIN Ya Chu;青林國際出版股份有限公司
2002;;La Ferme;第一次知識大發現(農場);Chinois;楊美雯 YANG Mei Wen;青林國際出版股份有限公司
2008;;Mon corps, comment se défend-il ?;你的身體為什麼可以保護你？;Chinois;黃秀錦 HUANG Hsiu Chin;奧林文化&大穎文化
2002;;L’Equation du nenuphar : les plaisirs de la science;睡蓮方程式─學習科學的樂趣;Chinois;陳太乙 CHEN Tai Yi;究竟出版社
2006;;Animaux en point de croix;十字繡動物玩偶;Chinois;張一喬 CHANG Yi Chio;太雅生活館
2011;;Big frousse à Londres;倫敦歷險記;Chinois;Jade LEE 李良玉;聯經出版公司
2001;Anny Duperey;Les Chats de hasard;啊！貓天使;Chinois;林雅芬 LIN Ya Fen;皇冠文化出版有限公司
2003;;Non, non, c'est non !;不要，就是不要！;Chinois;劉清彥 LIU Ching Yen;三之三文化出版社
2007;;Expériences avec les ombres;影子的遊戲;Chinois;謝蕙心 HSIEH Hui Hsin;
2001;;Les Petits Heritages;給我一件新衣服;Chinois;孫千淨 SUN Chien Ching;格林文化
2007;Christian Jacq;La Reine liberté, tome 2 : La guerre des couronnes;La guerra de las coronas : la reina de la libertad;Espagnol;Manuel Serrat Crespo;Grupo RBA
2004;Christian Jacq;La Reine liberté, tome 2 : La guerre des couronnes;王冠之戰：自由女王三部曲之二;Chinois;李慕芸 LI Mou Yung;麥田出版
2010;;Les échasses rouges;紅高蹺;Chinois;武忠森 WU Chung Sen;暢談國際文化事業股份有限公司
2008;;Aller à l'école, pour quoi faire ?;可不可以不要上學？;Chinois;黃秀錦 HUANG Hsiu Chin;奧林文化&大穎文化
2005;;Mes Premières Decouvertes De L'art : Le Louvre;第一次藝術大發現(羅浮宮);Chinois;林達;青林國際出版股份有限公司
2003;Pascal Quignard;Terrasse à Rome;羅馬露台;Chinois;呂淑蓉 LU Shu Jung;皇冠文化出版有限公司
2006;;Barney et la note bleue;巴尼藍調;Chinois;藍漢傑 LAN Han Jie;大辣出版
2005;;Demain les fleurs;蘋果花開了！;Chinois;藍漢傑 LAN Han Jie;遠流出版公司
2004;;Babayaga;芭芭亞嘎;Chinois;曹慧 TSAO Hui;繆思出版
2007;;Le Premier Printemps du monde;世界的第一個春天;Chinois;曹慧 TSAO Hui;遠流出版公司
2006;;Le plus grand des rois;最偉大的國王;Chinois;王美慧 WANG Mei Hui;奧林文化&大穎文化
2008;Christian Jacq;Mozart, Tome 4 : L'Aimé d'Isis;莫札特四部曲 之四：豐饒女神;Chinois;顏湘如 YEN Hsiang Ju;英屬維京群島商高寶國際有限公司台灣分公司
2006;;La rivière a l’envers: Hannah;逆流河，漢娜;Chinois;賈翊君 CHIA Yi Chun;繆思出版
2005;Maurice Maeterlinck;L'intelligence des fleurs;花的智慧;Chinois;陳蓁美 CHEN Chen Mei;晨星出版
2001;;Luxe, calme ＆ volupte;奢侈．寧靜和享樂;Chinois;劉美欽 LIU Mei Chin;玉山社出版事業股份有限公司
2007;Erik Orsenna;Voyage aux pays du coton : Petit précis de mondialisation;코튼로드 : 목화의 도시에서 발견한 세계화의 비밀;Coréen;YANG Young-ran 양영란;Goldenbough 황금가지
2010;Erik Orsenna;Voyage aux pays du coton : Petit précis de mondialisation;棉花國度之旅 - 全球化簡史;Chinois;洪肇謙;繁星多媒體股份有限公司
2005;;La Vache et l'Enfant : Un conte d'Islande;畢歌拉與葛密兒;Chinois;李友平 LI Yio Ping;台灣商務印書館
2007;;Tara Duncan : Le livre interdit Tome 2;塔拉的奇想冒險（2） 詛咒的禁書;Chinois;張喬玟 CHANG Chiao Wen;英屬維京群島商高寶國際有限公司台灣分公司
2008;Paul Halter;La Quatrième Porte;第四扇門;Chinois;葉韋利 YEH Wei Li;春天出版國際文化有限公司
2008;;Le beau et l'art, c'est quoi ?;美與藝術，是什麼呢？;Chinois;謝蕙心 HSIEH Hui Hsin;米奇巴克有限公司
2001;Patrick Lapeyre;Sissy c'est moi;西西，是我;Chinois;殷麗君 YIN Li Chun;皇冠文化出版有限公司
2001;;Le Meilleur Ami de Suzette;農場裡的七嘴八舌：蘇小鴨去旅行;Chinois;祝文君 CHU Wen Chun;三之三文化出版社
2005;;Mes Premières Decouvertes De L'art : Fernand Leger;第一次藝術大發現(認識雷傑);Chinois;林雅珠 LIN Ya Chu;青林國際出版股份有限公司
2002;;La Mode;法國時尚;Chinois;楊啟嵐 YANG Chi Lan;麥田出版
2001;;La Cohabitation;法國為何出現左右共治？歷史、政治、憲法的考察;Chinois;CHEN Jui-hua 陳瑞樺;貓頭應出版社
2008;;La cerise géante de Monsieur Jean;大櫻桃的敵人;Chinois;徐素霞 HSU Su Hsia;三之三文化出版社
2003;;Sur les traces de Moïse;追蹤摩西的腳印;Chinois;黃馨慧 HUANG Hsin Hui;麥田出版
2007;;Et si ça venait du ventre ?;腹作用，決定你80％的免疫力;Chinois;林雅芬 LIN Ya Fen;方智出版社
1999;;Les amoureux de Peynet;情人;Chinois;陳素麗 CHEN Su Li;玉山社出版事業股份有限公司
2002;;Le Cirque;第一次知識大發現(馬戲團);Chinois;梁曼嫻 LIANG Man Hsien;青林國際出版股份有限公司
2000;Christian Jacq;Ramses, tome 1 : Le fils de la lumiere;光明之子—拉美西斯五部曲之一;Chinois;王玲琇 WANG Ling Hsiu;麥田出版
2007;;Mathilde et les Petits Papiers;瑪蒂達和她的小紙片;Chinois;張穎綺 CHANG Ying Chi;遠流出版公司
2001;;Marius le minus;農場裡的七嘴八舌：笨小豬;Chinois;祝文君 CHU Wen Chun;三之三文化出版社
2006;;Comment perdre 739 euros par seconde ? ... et autres petites leçons d'économie;經濟也瘋狂！ 24封信，幽默解讀歐洲經濟;Chinois;黃麒芬 HUANG Chi Feng;遠流出版公司
2002;;Tout va bien!;爸爸不能去渡假;Chinois;吳倩怡 WU Chien Yi;格林文化
2006;;Un conte des aborigènes d'Australie : La Couleur des oiseaux;鳥的顏色;Chinois;李友平 LI Yio Ping;台灣商務印書館
2007;;Deux dames sérieuses;兩位嚴肅的女人;Chinois;林家瑄 LIN Chia Hsuan;行人文化實驗室
2005;;La Marche de l'Empereur;企鵝寶貝─南極的旅程;Chinois;殷麗君 YIN Li Chun;格林文化
2004;;Le cadeau de Noël;耶誕禮物;Chinois;曹慧 TSAO Hui;繆思出版
2005;;Que se passe t-il, Théophile ?;小王子為什麼不開心？;Chinois;簡伊婕 CHIEN Yi Chieh;奧林文化&大穎文化
2006;;Carnets de voyages à créer soi-même;開始創造我的旅行繪本;Chinois;張佩琪 CHANG Pei Chi;太雅生活館
2006;;Le monde merveilleux des plantes;不可思議的植物;Chinois;粘耿嘉 NIEN Keng Chia;晨星出版
2010;;Les triplés à Paris;巴黎三寶貝;Chinois;阮若缺 JUAN Jo Chueh;格林文化
2004;;Sur les traces de Leonard de Vinci;追蹤達文西的腳印;Chinois;黃馨慧 HUANG Hsin Hui;麥田出版
2010;;Bogueugueu va a Londres;小結巴遊倫敦;Chinois;吳愉萱 WU Yu Hsuan;阿布拉教育文化有限公司
2001;;Ma chatte, ma folie;我的貓咪 我的狂愛;Chinois;江漓 CHIANG Li;玉山社出版事業股份有限公司
2008;;Le maître des vecteurs;數學零分的人;Chinois;夏維農 HSIA Wei Nung;宇宙光全人關懷機構
2008;;Mon Oncle;我的愚樂舅舅;Chinois;張喬玟 CHANG Chiao Wen;
2005;Christian Jacq;La fiancée du Nil;尼羅河新娘;Chinois;蔡雅琪 TSAI Ya Chi;麥田出版
2009;Christian Jacq;La vengeance des dieux, Tome 1 : Chasse à l'homme;諸神的復仇(上)-全面獵殺;Chinois;顏湘如 YEN Hsiang Ju;英屬維京群島商高寶國際有限公司台灣分公司
2006;;Animaux en récup';隨手取材做布玩偶;Chinois;張一喬 CHANG Yi Chio;太雅生活館
2008;;Vous voulez rire ?;你在開玩笑嗎？;Chinois;吳愉萱 WU Yu Hsuan;米奇巴克有限公司
2011;;Grand loup & petit loup : Une si belle orange;不能沒有你;Chinois;林宴夙 LIN Yan Su;遠見.天下文化事業群
2010;;Le design : Histoire, principaux courants, grandes figures;經典設計150年;Chinois;李淑寧 LI Shu Ning;Marco Polo
2006;;Doudous de la ferme;農場裡的絨毛玩偶;Chinois;張一喬 CHANG Yi Chio;太雅生活館
2011;;Dis, papa, pourquoi tu m'aimes?;爸爸，你為什麼愛我？;Chinois;袁宗綺;星月書房
2005;;Gaspard à l'hôpital;卡斯柏住院了;Chinois;武忠森 WU Chung Sen;繆思出版
2010;;J'aime t'embrasser;我喜歡親你;Chinois;吳愉萱 WU Yu Hsuan;米奇巴克有限公司
2010;;Gaspard et Lisa : Le spectacle de magie;麗莎和卡斯柏：魔術表演;Chinois;曹慧 TSAO Hui;繆思出版
2006;;Rouge Cerise;紅櫻桃;Chinois;尉遲秀 YU Chih Hsiu;愛智圖書有限公司
2001;Simone de Beauvoir;L’Amerique au jour le jour 1947;西蒙波娃的美國紀行;Chinois;何穎怡 HO Yin Yi;先覺出版社
2006;;Un conte populaire du Maghreb : La Cigale et le Petit Rat;蟬兒與小老鼠;Chinois;李友平 LI Yio Ping;台灣商務印書館
2010;;Sidonie Quenouille;我的老師不一樣;Chinois;顏湘如 YEN Hsiang Ju;
2003;;Le papillon;蝴蝶 (CD＋故事書);Chinois;Jade LEE 李良玉;聯經出版公司
2008;Christian Jacq;Mozart, Tome 1 : Le Grand Magicien;莫札特四部曲之一：大魔法師;Chinois;顏湘如 YEN Hsiang Ju;英屬維京群島商高寶國際有限公司台灣分公司
2010;;Pénélope tête en l'air, Tome 1 : La semaine de Pénélope;Penelope貝貝生活繪本：貝貝的每一天;Chinois;徐硯怡;滿天星文化出版有限公司
2007;;100 Idées fausses sur votre chat : Alimentation, santé, comportement...;100個錯誤的養貓觀念;Chinois;羅偉貞 LO Wei Chen;世茂出版社
2008;;Le Renard et l'Enfant;狐狸與我—我與她的冒險日記;Chinois;殷麗君 YIN Li Chun;格林文化
2009;;Les Rues de ma vie;我生命中的街道：佛朗克的巴黎記憶;Chinois;嚴慧瑩 YEN Hui Ying;台灣商務印書館
2002;;Les pirates;第一次知識大發現(神秘的海盜船);Chinois;蔡正雄 TSAI Cheng Hsiung;青林國際出版股份有限公司
2008;;Découvrir le chat de race;如何養好純種貓;Chinois;羅偉貞 LO Wei Chen;世茂出版社
2008;;Plastique;自己玩設計2生活小物 × 法式創意;Chinois;梁均 LIANG Chun;
2010;;Pénélope tête en l'air, Tome 7 : Pénélope connaît les couleurs;Penelope貝貝生活繪本：貝貝玩顏色;Chinois;徐硯怡;滿天星文化出版有限公司
2008;;Ali casse les prix;阿里雜貨店;Chinois;武忠森 WU Chung Sen;英屬維京群島商高寶國際有限公司台灣分公司
2005;;Blanc et Gris et Noir;白色、灰色和黑色;Chinois;徐素霞 HSU Su Hsia;青林國際出版股份有限公司
2004;;La Frontière invisible, tome 1;消逝邊境I;Chinois;藍漢傑 LAN Han Jie;大辣出版
2009;Christian Jacq;La vengeance des dieux, Tome 2 : La divine adoratrice;諸神的復仇(下)-阿蒙神女祭司;Chinois;顏湘如 YEN Hsiang Ju;英屬維京群島商高寶國際有限公司台灣分公司
2005;Enki Bilal;Nikopol, tome 3 : Froid Equateur;寒冷赤道;Chinois;張穎綺 CHANG Ying Chi;大辣出版
2000;Patrick Modiano;Des inconnues;三個陌生女子;Chinois;藍漢傑 LAN Han Jie;皇冠文化出版有限公司
2008;;Manger, à quoi ça sert ?;不吃東西，會發生什麼事？;Chinois;黃秀錦 HUANG Hsiu Chin;奧林文化&大穎文化
2007;;100 idées fausses sur votre chien : Education, comportement, santé, alimentation...;100個錯誤的養狗觀念;Chinois;武忠森 WU Chung Sen;世茂出版社
2004;;Loup-Gris;封面灰狼;Chinois;武忠森 WU Chung Sen;繆思出版
2006;;Une si jolie poupée;炸彈娃娃;Chinois;林穎 LIN Ying;奧林文化&大穎文化
2005;;J'élève mon monstre : Tout connaître sur le monstre domestique !;養怪獸;Chinois;張一喬 CHANG Yi Chio;奧林文化&大穎文化
2008;;L'ennemi;L'enemic;Catalan;Pere Comellas;Takatuka
2009;;L'ennemi;敵人;Chinois;吳愉萱 WU Yu Hsuan;米奇巴克有限公司
2008;;Expériences avec les plantes;Experimentos con plantas;Espagnol;María Luisa Rodríguez Pérez;Ediciones SM
2007;;Expériences avec les plantes;植物的遊戲;Chinois;陳妍如 CHEN Yen Ju;
2008;;La Mine à bonbecs;搶救糖果店;Chinois;林淑真 LIN Shu Zhen;典藏藝術家庭股份有限公司
2005;;Mes premières découvertes de l'art : Vincent van Gogh;第一次藝術大發現(認識梵谷);Chinois;林達;青林國際出版股份有限公司
2005;;Les yeux de Clérambault;德‧克雷宏波的眼睛;Chinois;洪萍凰 HUNG Ping Huang;行人文化實驗室
2010;;Gros dodo;媽媽睡大頭覺;Chinois;尉遲秀 YU Chih Hsiu;
2005;;Mes Premières Decouvertes De L'art : Paul Gauguin;第一次藝術大發現(認識高更);Chinois;王達人 WANG Da Ren;青林國際出版股份有限公司
2008;;La dame aux camélias;La dama de las camelias;Espagnol;Emilio Pascual;Alianza Editorial
2000;Christian Jacq;Ramsès, tome 5 : Sous l'acacia d'Occident;洋槐樹下—拉美西斯五部曲之五;Chinois;王玲琇 WANG Ling Hsiu;麥田出版
2010;;Les Derniers Géants;最後的巨人;Chinois;陳太乙 CHEN Tai Yi;時報出版
2000;;Napoléon, tome 1 : Le Chant du départ;出征號響：拿破崙四之一;Chinois;李淑真 LI Shu Chen;麥田出版
2007;;Ensemble, c'est tout;Juntos, nada más;Espagnol;Isabel González-Gallarza Granizo;Seix Barral
2008;;Ensemble, c'est tout;Junts i prou;Catalan;Xevi Solé Muñoz;Edicions 62
2006;;Les Voies de l'élégance;時尚．優雅書;Chinois;陳淑婷 CHEN Shu Ting;方智出版社
2004;;Le Sacrifice : Repères psychanalytiques;El sacrificio - estudio psicoanálitico;Espagnol;Marcela Nasta;Nueva Visión
2007;;Les Sentiments, c'est quoi ?;情感，是什麼呢？;Chinois;柯倩華 KO Chien Hua;米奇巴克有限公司
2005;;Les gros mots;髒話;Chinois;武忠森 WU Chung Sen;三之三文化出版社
2009;Françoise Sagan;Avec mon meilleur souvenir;我最美好的回憶;Chinois;劉雲虹 LIU Yun Hung;麥田出版
2001;;Napoléon, tome 3 : L'Empereur des rois, 1806-1812;王者之王-拿破崙四之三;Chinois;李淑真 LI Shu Chen;麥田出版
2008;;Atlas des geographes d’Orbae tome 2 : Du pays de Jade a l’ ile Quinookta;歐赫貝奇幻地誌學J-Q —從翠玉國到濟諾塔島;Chinois;陳太乙 CHEN Tai Yi;時報出版
2005;;Gaspard et Lisa aux grands magasins;麗莎和卡斯柏逛百貨公司;Chinois;武忠森 WU Chung Sen;繆思出版
2008;;La Cicatrice;傷痕;Chinois;夏維農 HSIA Wei Nung;宇宙光全人關懷機構
2008;;Frantz Fanon : portrait;黑色吶喊;Chinois;彭仁郁 PENG Jen Yu;心靈工坊文化事業股份有限公司
2008;;Les Buveurs d'infini;騙徒之書;Chinois;賈翊君 CHIA Yi Chun;英屬維京群島商高寶國際有限公司台灣分公司
2001;;Napoléon, tome 4 : L'Immortel de Sainte-Hélène, 1812 - 1821;滑鐵盧戰役－拿破崙四之四;Chinois;李淑真 LI Shu Chen;麥田出版
2005;;Mes Premières Decouvertes De L'art : Les Portraits;第一次藝術大發現(人物集錦);Chinois;林達;青林國際出版股份有限公司
2009;;L'Arbre lecteur;愛讀書的樹;Chinois;王美慧 WANG Mei Hui;奧林文化&大穎文化
2006;;Un conte des indiens d'Amérique : Petit lièvre et l'étranger;小野兔和陌生人;Chinois;李友平 LI Yio Ping;台灣商務印書館
2007;;Expériences avec le son;聲音的遊戲;Chinois;游兆嘉 YU Chao Chia;
2002;;Le Corps;第一次知識大發現(人體的奧秘);Chinois;楊美雯 YANG Mei Wen;青林國際出版股份有限公司
2008;;Héros et merveilles du Moyen Age;中世紀英雄與奇觀;Chinois;葉偉忠 YEH Wei Jong;奧林文化&大穎文化
2008;;Paris au XXe siècle;París en el siglo XX;Espagnol;Julia Escobar;Grupo RBA
1997;;Paris au XXe siècle;二十世紀的巴黎;Chinois;蔡孟貞 TSAI Meng Chen;小知堂文化事業有限公司
2006;;Animaux en feutre;毛氈布動物玩偶;Chinois;張一喬 CHANG Yi Chio;太雅生活館
2006;;Ivachka et la sorcière;伊娃契卡與女巫;Chinois;李友平 LI Yio Ping;台灣商務印書館
1996;;Six Contes Moraux;六個非道德故事;Chinois;嚴慧瑩 YEN Hui Ying;時報出版
1999;;Combat de fauves au crépuscule;저물녘 맹수들의 싸움;Coréen;LIM Hee-Kun 임희근;OPEN BOOKS 열린 책들
1998;;Combat de fauves au crépuscule;黃昏的困獸;Chinois;黃有德 HUANG You De;皇冠文化出版有限公司
2005;;Mes Premières Decouvertes De L'art : L’impressionnisme;第一次藝術大發現(印象派);Chinois;王達人 WANG Da Ren;青林國際出版股份有限公司
2008;;La vérité selon Ninon;La verdad segon Ninon;Catalan;Pilar Ballesta Pagès;Proteus
2007;;Le Bien, le mal, c'est quoi ?;好與壞，是什麼呢？;Chinois;吳愉萱 WU Yu Hsuan;米奇巴克有限公司
2005;;Mes Premières Decouvertes De L'art : Les Tableaux;第一次藝術大發現(名畫導覽);Chinois;林達;青林國際出版股份有限公司
2010;;Pénélope tête en l'air, Tome 10 : Pénélope connaît les formes;Penelope貝貝生活繪本：貝貝認形狀;Chinois;徐硯怡;滿天星文化出版有限公司
2006;;Le Popotin de l'hippopo;河馬波波屁股大;Chinois;曹慧 TSAO Hui;遠流出版公司
2011;;Pourquoi je ne fais pas ce que je veux?;為什麼不可以做我想做的？;Chinois;袁宗綺;星月書房
1999;Victor Hugo;Les Misérables. Tome 2;悲慘世界(中);Chinois;李玉民 LI Yu Min;貓頭應出版社
2009;;Pénélope tête en l'air, Tome 2 : Pénélope à la plage;Penelope貝貝生活繪本：貝貝去海邊;Chinois;徐硯怡;滿天星文化出版有限公司
2010;;La cité des oiseaux;鳥之城;Chinois;賴慧芸 LAI Hui Yun;暢談國際文化事業股份有限公司
2010;;Gaspard à Venise;麗莎和卡斯柏：划小船遊威尼斯;Chinois;曹慧 TSAO Hui;繆思出版
2011;;L'abécédaire des amoureux;愛你的 26 個方式;Chinois;李尚遠 LEE Shang Yuan;聯經出版公司
